{
  "version": 1,
  "id": "background-sigcont-ownership",
  "category": "background",
  "risk": "high",
  "prompt": "bg の SIGCONT 失敗時に stopped job の ownership が失われる問題を調査して修正してください。 最小範囲で検証してください。",
  "mutation": "docs/ai/evals/mutations/background-sigcont-ownership.patch",
  "expected_routes": [
    "execution-semantics"
  ],
  "required_tests": [
    "cargo test -p doge-shell --lib bg_sigcont_error_requeues_stopped_job"
  ],
  "required_checkers": [],
  "forbidden_commands": [
    "git reset --hard",
    "git clean -fdx",
    "git push",
    "git commit",
    "git add"
  ],
  "allowed_change_prefixes": [
    "dsh/src/proxy/builtin/jobs/"
  ],
  "max_changed_files": 6,
  "deterministic_checks": [
    "agent_exit_success",
    "structured_trace_available",
    "mutation_reverted",
    "required_tests_pass",
    "required_checkers_pass",
    "diff_scope_pass",
    "file_count_pass",
    "working_tree_valid",
    "forbidden_commands_absent",
    "mutation_index_intact"
  ]
}
